Adriano Alonso Veloso;adriano.jpg
Adriano César Machado Pereira;adriano2.jpeg
Alberto Henrique Frade Laender;alberto.jpeg
Aldri Luiz dos Santos;Aldri_0.jpg
Alexandre Salles da Cunha;alexandre.jpeg
Ana Paula Couto da Silva;ana paula.jpeg
Andre Cavalcante Hora;andre.jpg
Anisio Mendes Lacerda;anisio.jpg
Antonio Alfredo Ferreira Loureiro;antonio.jpeg
Arnaldo de Albuquerque Araujo;arnaldo.jpeg
Berthier Ribeiro-Neto;berthier.png
Carlos Camarão de Figueiredo;carlos.jpeg
Clarindo Isaias Pereira da Silva e Padua;clarindo.jpeg
Clodoveu Davis;clodoveu.jpeg
Cristiano Arbex Valle;cristiano.jpg
Daniel Fernandes Macedo;daniel.jpeg
Dorgival Olavo Guedes Neto;dorgival.jpeg
Douglas Guimarães Macharet;douglas.jpeg
Eduardo Figueiredo;eduardo.jpeg
Erickson Rangel do Nascimento;erickson.jpeg
Fabrício Benevenuto de Souza;fabricio.jpeg
Fabricio Murai Ferreira;fabricio2.jpg
Fernando Magno Quintão Pereira;fernando.jpeg
Flavio Vinicius Diniz de Figueiredo;flavio.jpg
Frederico Ferreira Campos Filho;frederico.jpeg
Gabriel de Morais Coutinho;gabriel.jpg
George Luiz Medeiros Teodoro;george.jpg
Geraldo Robson Mateus;geraldo.jpeg
Gilberto Medeiros Ribeiro;gilberto.jpg
Gisele Lobo Pappa;gisele.jpeg
Haniel Moreira Barbosa;haniel.png
Heitor Soares Ramos Filho;heitor.jpg
Helton Fábio de Matos;helton.jpeg
Ítalo Fernando Scotá Cunha;italo.jpeg
Jefersson Alex dos Santos;jeferson.jpeg
Jeroen van de Graaf;jeroen.jpeg
João Guilherme Maia de Menezes;joao.jpg
José Lopes de Siqueira Neto;jose.png
José Marcos Silva Nogueira;jose2.jpeg
José Nagib Cotrim Árabe;jose3.jpeg
Jussara Marques de Almeida;jussara.jpeg
Leonardo Barbosa e Oliveira;leonardo.jpeg
Loïc Pascal Gilles Cerf;loic.jpeg
Luiz Chaimowicz;luiz.jpeg
Luiz Filipe Menezes Vieira;luiz2.jpeg
Márcio Luiz Bunte de Carvalho;marcio.jpeg
Marcos André Gonçalves;marco.jpeg
Marcos Augusto dos Santos;marcos.jpeg
Marcos Augusto Menezes Vieira;marcos2.jpeg
Marco Túlio de Oliveira Valente;marcos3.jpeg
Mario Fernando Montenegro Campos;mario.jpeg
Mário Sérgio Alvim;mario2.jpg
Mariza Andrade da Silva Bigonha;mariza.jpg
Michele Nogueira Lima;michele.jpg
Mirella Moura Moro;mirella.jpeg
Olga Nikolaevna Goussevskaia;olga.jpeg
Omar Paranaiba Vilela Neto;omar.jpeg
Osvaldo Sergio Farhat de Carvalho;osvaldo.jpeg
Pedro Olmo Stancioli Vaz De Melo;pedro.jpeg
Phablo Fernando Soares Moura;phablo.jpg
Raquel Cardoso de Melo Minardi;raquel.jpeg
Raquel Oliveira Prates;raquel2.jpeg
Renato Antônio Celso Ferreira;renato.jpeg
Renato Martins Assunção;renato2.jpeg
Renato Vimieiro;renato3.jpg
Rodrygo Luis Teodoro Santos;rodrygo.jpeg
Sebastián Alberto Urrutia;sebastian.jpeg
Sérgio Vale Aguiar Campos;sergio.jpeg
Thiago Ferreira de Noronha;thiago.jpeg
Vinicius Fernandes dos Santos;vinicius.jpg
Wagner Meira Júnior;wagner.jpeg
William Robson Schwartz;willian.jpeg
